{
  "id": "integrate-the-inequality",
  "situation": "written-solution",
  "intent": "不等式の各辺を積分して、新しい不等式を得る",
  "en": "Integrating both sides of the inequality from 0 to 1, we get",
  "ja": "不等式の両辺を 0 から 1 まで積分すると、",
  "register": "written",
  "tags": [
    "integration",
    "inequality"
  ],
  "sources": [
    {
      "type": "editorial"
    }
  ],
  "confidence": "likely",
  "updated": "2026-09-28",
  "evidence": {
    "written": {
      "integrate both sides | integrate … sides": 20
    },
    "sources": [
      "mit-notes",
      "openstax-calculus"
    ],
    "counted": "2026-09-28"
  }
}
