{
  "id": "class-listening-what-do-you-notice",
  "situation": "class-listening",
  "intent": "気づいたことを言わせる",
  "en": "What do you notice?",
  "ja": "何か気づいたことはありますか？",
  "register": "neutral",
  "tags": [
    "asking-the-class"
  ],
  "sources": [
    {
      "type": "editorial"
    }
  ],
  "confidence": "likely",
  "updated": "2026-09-28",
  "evidence": {
    "spoken": {
      "what do you notice": 6
    },
    "sources": [
      "micase",
      "mit-18.06",
      "yt:profleonard"
    ],
    "counted": "2026-09-28"
  },
  "flags": [
    {
      "code": "corpus-attested-only",
      "note": "どの要の部分も 10 件に届かない（講義のコーパスと MICASE の教員の発話で数えた）ので ①②③ で判定しない。話者のコーパスで首位の要の部分 what do you notice（6 件。3 件以上）。register は主張しない。",
      "raised": "2026-09-28"
    }
  ]
}
