{
  "id": "class-listening-lowest-quiz-dropped",
  "situation": "class-listening",
  "intent": "小テストの最低点を成績から除くと伝える",
  "en": "Your lowest quiz score will be dropped.",
  "ja": "小テストの一番低い点は成績に入れません。",
  "register": "neutral",
  "tags": [
    "classroom",
    "grading"
  ],
  "sources": [
    {
      "type": "editorial"
    }
  ],
  "confidence": "verified",
  "updated": "2026-09-28",
  "evidence": {
    "sources": [],
    "counted": "2026-09-26"
  },
  "flags": [
    {
      "code": "corpus-human-settled",
      "note": "要の部分は人間が決めた（2026-09-26。docs/DECISIONS.md「Phase 3 フレーズ 2 の前の修正」の 4）。Your lowest quiz score will be dropped.。register は主張しない。",
      "raised": "2026-09-26"
    }
  ],
  "reviewed": {
    "machine": null,
    "audit": "2026-09-28",
    "human": null
  }
}
