{
  "id": "explaining-solution-let-me-back-up",
  "situation": "explaining-solution",
  "intent": "説明の途中で誤りに気づき、少し戻る",
  "en": "Wait, let me back up — I made a mistake here.",
  "ja": "ちょっと戻ります。ここで間違えました。",
  "register": "casual",
  "variants": [
    {
      "en": "Wait, I take that back.",
      "register": "casual"
    }
  ],
  "tags": [
    "explaining",
    "mistakes"
  ],
  "sources": [
    {
      "type": "editorial"
    }
  ],
  "confidence": "likely",
  "updated": "2026-09-28",
  "evidence": {
    "spoken": {
      "let me back up | let's back up | back up a little | back up a second | back up a step | i made a mistake | made a mistake here": 31,
      "take that back !up": 11
    },
    "sources": [
      "khan-algebra",
      "khan-ap-calc",
      "khan-ap-stats",
      "khan-middle",
      "micase",
      "mit-18.01",
      "mit-18.02",
      "mit-18.03",
      "mit-6.042",
      "yt:blackpenredpen",
      "yt:organicchem",
      "yt:profleonard"
    ],
    "counted": "2026-09-28"
  }
}
