{
  "id": "check-the-sign",
  "situation": "class-listening",
  "intent": "各区間で f′ の符号を調べる",
  "en": "Let's check the sign of f prime on each interval.",
  "ja": "各区間で f′ の符号を調べましょう。",
  "register": "neutral",
  "variants": [
    {
      "en": "Check the sign.",
      "register": "neutral"
    }
  ],
  "tags": [
    "derivatives",
    "sign-chart"
  ],
  "sources": [
    {
      "type": "editorial"
    }
  ],
  "confidence": "likely",
  "updated": "2026-09-28",
  "evidence": {
    "spoken": {
      "sign of f prime !prime | the sign of the derivative": 8,
      "check the sign": 3
    },
    "sources": [
      "mit-18.01",
      "mit-18.02"
    ],
    "counted": "2026-09-28"
  },
  "flags": [
    {
      "code": "corpus-attested-only",
      "note": "どの要の部分も 10 件に届かない（講義のコーパスと MICASE の教員の発話で数えた）ので ①②③ で判定しない。話者のコーパスで首位の要の部分 sign of f prime !prime | the sign of the derivative（8 件。3 件以上）。register は主張しない。",
      "raised": "2026-09-28"
    }
  ]
}
