{
  "id": "group-study-is-that-right",
  "situation": "group-study",
  "intent": "自分の答えが合っているか確かめる",
  "en": "The answer is 3, is that right?",
  "ja": "答えは 3 で合ってる？",
  "register": "casual",
  "variants": [
    {
      "en": "Is it just 2x?",
      "register": "casual"
    }
  ],
  "tags": [
    "group-study",
    "checking"
  ],
  "sources": [
    {
      "type": "editorial"
    }
  ],
  "confidence": "likely",
  "updated": "2026-10-07",
  "evidence": {
    "spoken": {
      "!or is it just": 10,
      "is that right !here": 14
    },
    "sources": [
      "micase"
    ],
    "counted": "2026-10-07"
  },
  "flags": [
    {
      "code": "audit-major-fix",
      "note": "Phase 5 監査（2026-10-07）で大きな直し: decide の ② で en が Is it just 2x? に替わり ja が台帳の文のまま。読むと is that right 13 ／ is it just 1〜2、形で除くと 14 ／ 10 の ② → en を The answer is 3, is that right?（台帳の 1 つ目の文）、Is it just 2x? を variant に。見直す点: 17 ・15 件の読み、形（!here ・!or）。次の監査のセッションが見直す。",
      "raised": "2026-10-07"
    }
  ],
  "reviewed": {
    "machine": null,
    "audit": "2026-10-07",
    "human": null
  }
}
