{
  "id": "in-order",
  "situation": "class-listening",
  "intent": "計算を左から順に進めると伝える",
  "en": "Work from left to right.",
  "ja": "左から順に計算します。",
  "register": "neutral",
  "tags": [
    "order-of-operations"
  ],
  "sources": [
    {
      "type": "editorial"
    }
  ],
  "confidence": "verified",
  "updated": "2026-09-28",
  "evidence": {
    "spoken": {
      "left to right | from left to right": 51
    },
    "sources": [
      "khan-middle",
      "micase",
      "mit-18.01",
      "mit-18.03",
      "mit-6.042",
      "yt:3blue1brown",
      "yt:organicchem",
      "yt:profleonard"
    ],
    "counted": "2026-09-28"
  },
  "reviewed": {
    "machine": null,
    "audit": "2026-09-28",
    "human": null
  }
}
