{
  "id": "add-up-thin-disks",
  "situation": "class-listening",
  "intent": "回転体の体積を、薄く切った円板の体積を足し合わせるものとして説明する",
  "en": "Think of it as cutting the solid into a bunch of thin slices and adding up their volumes.",
  "ja": "立体を薄く切って、その体積を足し合わせるイメージです。",
  "register": "neutral",
  "variants": [
    {
      "en": "We're adding up a bunch of thin disks.",
      "register": "neutral"
    }
  ],
  "tags": [
    "integration",
    "volume"
  ],
  "sources": [
    {
      "type": "editorial"
    }
  ],
  "confidence": "likely",
  "updated": "2026-09-28",
  "evidence": {
    "spoken": {
      "bunch of slices | thin slices | little slices": 11,
      "bunch of disks | lot of disks | stack of disks | infinitely many disks | little disks | thin disks": 5
    },
    "sources": [
      "khan-ap-calc",
      "mit-18.01",
      "mit-6.042",
      "yt:3blue1brown",
      "yt:blackpenredpen",
      "yt:profleonard"
    ],
    "counted": "2026-09-28"
  },
  "flags": [
    {
      "code": "audit-major-fix",
      "note": "Phase 5 監査（2026-09-28）で大きな直し: en に ja・intent の「足し合わせる」が無かった → Think of it as cutting the solid into a bunch of thin slices and adding up their volumes.（要の部分は同じ）。見直す点: en ・ja ・intent の対応、全件を読んだ 6 対 3（DECISIONS）。次の監査のセッションが見直す。",
      "raised": "2026-09-28"
    }
  ],
  "reviewed": {
    "machine": null,
    "audit": "2026-09-28",
    "human": null
  }
}
