{
  "id": "class-listening-notice-that",
  "situation": "class-listening",
  "intent": "注目すべき点を示す",
  "en": "Notice that the two triangles share a side.",
  "ja": "2 つの三角形が 1 辺を共有していることに注目してください。",
  "register": "neutral",
  "variants": [
    {
      "en": "The key thing to see here is that they share a side.",
      "register": "neutral"
    }
  ],
  "tags": [
    "explaining"
  ],
  "sources": [
    {
      "type": "editorial"
    }
  ],
  "confidence": "verified",
  "updated": "2026-09-28",
  "evidence": {
    "spoken": {
      "notice that": 492,
      "the key thing": 20
    },
    "sources": [
      "khan-algebra",
      "khan-ap-calc",
      "khan-ap-stats",
      "khan-middle",
      "micase",
      "mit-18.01",
      "mit-18.02",
      "mit-18.03",
      "mit-18.06",
      "mit-6.042",
      "yt:3blue1brown",
      "yt:blackpenredpen",
      "yt:nancypi",
      "yt:organicchem",
      "yt:patrickjmt",
      "yt:profleonard"
    ],
    "counted": "2026-09-28"
  },
  "reviewed": {
    "machine": null,
    "audit": "2026-09-28",
    "human": null
  }
}
