{
  "id": "office-hours-is-this-rigorous-enough",
  "situation": "office-hours",
  "intent": "自分の証明が十分に厳密かを見てもらう",
  "en": "Could you look over my proof and tell me if it's rigorous enough?",
  "ja": "この証明、これで十分厳密か見ていただけますか。",
  "register": "polite",
  "variants": [
    {
      "en": "Is this rigorous enough?",
      "register": "neutral"
    }
  ],
  "tags": [
    "office-hours",
    "proof"
  ],
  "sources": [
    {
      "type": "editorial"
    }
  ],
  "confidence": "verified",
  "updated": "2026-09-28",
  "evidence": {
    "spoken": {
      "look over my | look at my proof | check my proof | check my work | get it looked over": 1
    },
    "sources": [
      "micase"
    ],
    "counted": "2026-09-28"
  },
  "flags": [
    {
      "code": "corpus-attested-only",
      "note": "どの要の部分も 10 件に届かない（MICASE の学生の発話で数えた）ので ①②③ で判定しない。MICASE の学生の発話では首位が 3 件未満（look over my | look at my proof | check my proof | check my work | get it looked over 1 件）。Math Stack Exchange の質問で最も多い要の部分 look over my | look at my proof | check my proof | check my work | get it looked over（1472 件。3 件以上）なので使われている。en の要の部分 look over my | look at my proof | check my proof | check my work | get it looked over も 1472 件（3 件以上）なので en のまま。register は主張しない。",
      "raised": "2026-09-28"
    }
  ],
  "reviewed": {
    "machine": null,
    "audit": "2026-09-28",
    "human": null
  }
}
