{
  "id": "class-listening-oops-good-catch",
  "situation": "class-listening",
  "intent": "板書の誤りを認めて直す",
  "en": "Oops, my mistake — that should be a minus.",
  "ja": "おっと、間違えました。ここはマイナスですね。",
  "register": "casual",
  "variants": [
    {
      "en": "Sorry, my bad — that should be a minus.",
      "register": "casual"
    },
    {
      "en": "Good catch, thank you.",
      "register": "neutral"
    }
  ],
  "tags": [
    "classroom",
    "board"
  ],
  "sources": [
    {
      "type": "editorial"
    }
  ],
  "confidence": "likely",
  "updated": "2026-09-28",
  "evidence": {
    "spoken": {
      "my mistake !was !i | my bad !little !attitude": 11,
      "thanks for catching | thank you for catching | good catch": 3
    },
    "sources": [
      "micase",
      "yt:3blue1brown",
      "yt:profleonard"
    ],
    "counted": "2026-09-28"
  }
}
