{
  "id": "discord-thanks",
  "situation": "discord",
  "intent": "チャットで手短にお礼を言う",
  "en": "thanks, that helped",
  "ja": "ありがとう、助かった！",
  "register": "casual",
  "variants": [
    {
      "en": "ty!",
      "register": "casual",
      "note": "thank you の略。"
    }
  ],
  "tags": [
    "discord",
    "thanks"
  ],
  "sources": [
    {
      "type": "editorial"
    }
  ],
  "confidence": "verified",
  "updated": "2026-10-07",
  "evidence": {
    "spoken": {
      "that helped | that helps": 23
    },
    "sources": [
      "micase"
    ],
    "counted": "2026-10-07"
  },
  "reviewed": {
    "machine": null,
    "audit": "2026-10-07",
    "human": null
  }
}
