{
  "id": "group-study-oh-that-makes-sense",
  "situation": "group-study",
  "intent": "説明を聞いて納得したと伝える",
  "en": "Oh, I see.",
  "ja": "あ、なるほど！",
  "register": "casual",
  "variants": [
    {
      "en": "Okay, that makes sense.",
      "register": "casual"
    }
  ],
  "tags": [
    "group-study",
    "understanding"
  ],
  "sources": [
    {
      "type": "editorial"
    }
  ],
  "confidence": "verified",
  "updated": "2026-10-07",
  "evidence": {
    "spoken": {
      "oh i see | ohh i see | oh okay i see": 32,
      "okay that makes sense | yeah that makes sense | oh that makes sense": 6
    },
    "sources": [
      "micase"
    ],
    "counted": "2026-10-07"
  },
  "reviewed": {
    "machine": null,
    "audit": "2026-10-07",
    "human": null
  }
}
