{
  "id": "office-hours-english-terms-are-new",
  "situation": "office-hours",
  "intent": "日本語で習ったので、英語の数学用語に慣れていないと伝える",
  "en": "I learned this in Japanese, so I'm still getting used to the English terms.",
  "ja": "日本語で習ったので、英語の数学用語にまだ慣れていません。",
  "register": "neutral",
  "variants": [
    {
      "en": "I understand the math, but I don't know the English terms yet.",
      "register": "neutral"
    }
  ],
  "tags": [
    "office-hours",
    "vocabulary"
  ],
  "sources": [
    {
      "type": "editorial"
    }
  ],
  "confidence": "likely",
  "updated": "2026-09-28",
  "evidence": {
    "sources": [],
    "counted": "2026-09-26"
  },
  "flags": [
    {
      "code": "corpus-attested-only",
      "note": "どの要の部分も 10 件に届かない（MICASE の学生の発話で数えた）ので ①②③ で判定しない。MICASE の学生の発話では首位が 3 件未満（0 件）。Math Stack Exchange の質問で最も多い要の部分 the english terms | english terms | used to the english（43 件。3 件以上）なので使われている。en の要の部分 the english terms | english terms | used to the english も 43 件（3 件以上）なので en のまま。register は主張しない。",
      "raised": "2026-09-28"
    }
  ]
}
