{
  "id": "apply-the-theorem",
  "situation": "class-listening",
  "intent": "定理を使う場面だと伝える",
  "en": "Now we can use the mean value theorem.",
  "ja": "ここで平均値の定理が使えます。",
  "register": "neutral",
  "variants": [
    {
      "en": "Now we can apply the intermediate value theorem.",
      "register": "neutral"
    }
  ],
  "tags": [
    "theorems"
  ],
  "sources": [
    {
      "type": "editorial"
    }
  ],
  "confidence": "likely",
  "updated": "2026-09-28",
  "evidence": {
    "spoken": {
      "use the … theorem": 95,
      "apply the … theorem": 27
    },
    "sources": [
      "khan-algebra",
      "khan-ap-calc",
      "khan-middle",
      "micase",
      "mit-18.01",
      "mit-18.02",
      "mit-18.03",
      "mit-6.042",
      "yt:3blue1brown",
      "yt:nancypi",
      "yt:organicchem",
      "yt:patrickjmt",
      "yt:profleonard"
    ],
    "counted": "2026-09-28"
  }
}
