{
  "id": "group-study-write-up-our-own",
  "situation": "group-study",
  "intent": "答案は各自で書く決まりを確認する",
  "en": "We can talk about the problems, but we have to write up our own solutions.",
  "ja": "相談はいいけど、答案はそれぞれ自分で書かないといけないよ。",
  "register": "neutral",
  "tags": [
    "group-study",
    "academic-integrity"
  ],
  "sources": [
    {
      "type": "editorial"
    }
  ],
  "confidence": "likely",
  "updated": "2026-10-08",
  "evidence": {
    "sources": [],
    "counted": "2026-09-26"
  },
  "flags": [
    {
      "code": "corpus-human-settled",
      "note": "en は人間が決めた（We can talk about the problems, but we have to write up our own solutions. のまま。米国のシラバスの協力の決まりの定番の言い方。ユーザーの決定 3（監査 13 の前。監査 12 の人間レビュー行き））。各自で書く意味の動詞句は MICASE の学生の発話にも Math Stack Exchange の質問にも 3 件に届かない（DECISIONS）。register は主張しない。",
      "raised": "2026-10-08"
    }
  ],
  "reviewed": {
    "machine": null,
    "audit": "2026-10-07",
    "human": null
  }
}
